index,rating,reviewText,summary
0,5,"This book was the very first bookmobile book I bought when I was in the school book club. I loved the story then and I bet a dollar to a donut I will love it again. If my memory serves, I bought this book in 5th grade. That would have been about 1961. I am looking forward to reliving the memories.",50 + years ago...
1,1,"When I read the description for this book, I couldn't wait to read it. Once I downloaded it to my Kindle, I found it extremely hard to keep reading it.  To be honest, I stopped reading halfway through the book. It began slow and remained a slow, uninteresting read.  It lacked passion; not making love passion, but passion for life. Neither Jada or Aaron were interesting characters and the story was too, too `everything is perfect'.  Everybody is just so understanding and accommodating--the bit of drama with his father and her grandmother was blah.  To give an example of what I mean (and there are MANY), Aaron finally finds out almost  half way into the book that he fathered a child 5 years ago--keep in mind that Aaron and Jada kept in contact for a few months after he left and she never mentioned to him that she was pregnant. When she finally tells him he has a son, Aaron becomes overwhelmed with emotions (misty eyed) knowing that he's a father. WTH!  I think most men would be upset/angry to know that they had a child and the woman they love never told them! Not in this book; it's all good--all is well; NO PASSION.  OMG, don't let me get started on the scene when father and son finally meet. It was so over the top, it made me want to barf. Maybe if this scene had been towards the beginning of the book, it would have been touching. In the middle of the book after just too much blah it made me thrown down my kindle.  It was like eating a sweet dessert that was so sweet it made your teeth hurt. This book had a good theme, but no follow-through. Also, if we're to believe that Jada graduated from Harvard, then let it be reflected in her speech and her job. We're told that she has this wonderful personality which caused Aaron to fall in love with her--never saw it. If the author had described her as depressed and foolish--Yes! I would believe it in a heartbeat. She was boring. This book was so frustrating to read.  I truly struggled to read it as far as I did.  I finally stopped torturing myself because I realized it wasn't going to get any better.",Boring! Boring! Boring!
2,5,"I just had to edit this review. This book is an (I believe I got this right) an updated re-write. Thank god I didn't get the first version. It has moved into MY top 5 favorite. He (BECHETT DeSAXBY) is also in my top 5 Hero/daydream inducing gents.Didn't expect to like it. Seemed a little too debauched. ha ha ha. I freggin loved it. Matter of fact I'm over 21...well over 21...ran my batteries dead..NOW you know what batteries..I am broadening my reading tastes and buying anything Scottie Barrett writes. AN ABSOLUTE KEEPER (with a large supply of batteries).And for once the cover of that hunk matched the description. You guys can read it premise. What I loved is his portrayal and the FILET MIGNON in depth character study Scottie Barrett did. From the first, with 'Bechett baby' catchin a snooze in the hayloft after an early ""happy ending"" thats AFTER HE WENT OUT AND BROUGHT BACK HIS CASTLE'S meat for the week. At first he seemed like a wastrel. But he's the real deal. In modern times he would be a war hero. He's home from the crusades. He didn't think he would survive. The King suitably and righteously rewards him. He's in his early 30's. Very responsible and loving and enjoyin life. (HELL, I'M WELL OVER 21 AND I'D DO THE SAME THING)He earned it. It's his choice. And he takes it to the max.As I said I'm not doing story premise, but it's about 3 friends. 2 boys and 1 girl. Bechett baby is one of the boys, then his cousin (the other boy) and a girl.They were all raised together. He fell in love with the girl as children. Then life happens. The first scene AFTER he gets her back inside the castle walls...well....hmmmm, hmmmm, hmmmm.She is tricked into delivering some refreshments to his bedroom..and she walks in on a REAL TREAT! CRIPES MY OWN HEART RATE JUST PICKED UP,HONESTLY! For the faint of heart, she walks in on a Mfff, Ah-hem (can't breath)...she's stuck on stupid..I'm not! I must have read this scene 100 times and it still hasn't gotton old. I can just see his face when he turns around...luv,luv,luved it! So there's my re-wright. I've re-read this 3x's. I've only done that with 3 other books. I REALLY, REALLY, REALLY, REALLY LOVED THIS ONE. And for those of you whe know me from the other Amazon sites know I'm no shrinkin violet.So those of you who read the 1st version..throw it out..try this! YES YES YES this is a keeper,a heat inducer, and in MY top 5. (Now let's see where did I put my new toy?",Wiggleliscious/new toy ready/!!
3,5,"I don't normally buy 'mystery' novels because I just don't like them.  However, this time I decided to take a chance and I am glad I did.I found the story engrossing, the characters engaging, and it was well written.  I will buy more books from this author in this series.I still do not especially care for 'mystery' novels - I consider this book series an exception.",Very good read.
4,5,"This isn't the kind of book I normally read, although I try not to limit myself to certain genres. Sometimes I find epic fantasies a little tedious. Not so with this one! There wasn't one paragraph in this story that didn't hold my interest. Ty Johnston has a wonderful way with words so that his scenes come alive for the reader. I'm definitely buying books two and three of this trilogy!",Great Story!
5,4,"I really enjoyed how this story developed.  Its a well-written Sci-fi depicting what happens when an alien race quietly tries to study earth and one of the members of the scientific team gets away from the group and is discovered by a human.  The world-building of the alien race was easy to follow since explanations came steadily throughout the story instead of one long monologue at the beginning.The characters' personalities and situations were established for some time before they actually come in contact with each other and then their relationship developed at a believable rate as they first had the culture/language barrier and then that period of just exploring their differences and similarities before it grew into something of a romantic nature.Not to say physical attraction wasn't there pretty soon after they met though Kent is a bear about it because he's recently sworn off women and here at his campsite remote from civilization he is joined by a female.Kent is a biology professor and scientist who was very athletic and rugged liking to bike and camp out far off the beaten path.  He is startled by Povre's differences when he first sees them, but soon adjusts to appreciating her exotic beauty and her sweet curious spirit.  Povre is of a race that has some psychic ability and she senses many things in Kent's emotions.  At first his anger frightens her, but then he becomes protective and kind.After getting over their mutual surprise, the rest of the story's action is about dogging all the government and non-government groups interested in capturing Povre for their own obvious reasons.  And at the same time, they grow closer knowing that Povre's people will probably come for her and they will be separated and there is always the fear that she'll be discovered and captured.From time to time, the story shifts to a third character, Povre's mission leader and father who was forced to leave her behind when she wandered away from their exploration group.  He follows protocol and gets the others back to their ship and safety even while despairing over his daughter's absence.  He knows that if she is captured, she will not be treated well.The plot held no surprises for me and it was simplistic, but that was fine with me because it allowed me to focus on the developing romance between Kent and Povre.  They really were good together.  He was trustworthy and strong for her while at the same time he was tender and understanding of what she was going through.  Povre helped heal Kent's bruised heart, gave him someone to protect and love as well as showed him the delights of discovering something for the first time when he watched Povre enjoy nature.  What I really thought was interesting is that though both are humanoid and share enough characteristics to be compatible, this truly is an alien romance.  They really saw each other's souls under all the surface differences.It was a nice read and I recommend it to anyone who wants to read a light Sci-Fi Romance.","When an Alien Scientist Gets Lost in the Oregon Wilderness And a Human Scientist Finds Her, Love Is Their Discovery"
6,3,"I bought this book because I loved the cover and I try to read any Civil War romance I come across. Unfortunately, I wanted more story. If the book was longer to compensate for all the bedroom activity it would be a much better read. Both the Confederate Colonel and the Southern widow were good characters and relatable, but were only written at a surface level because not enough time was given to development. At least the readers were given memories from their past to help fill in some of the blanks. And the epilogue detracted from the story in my opinion.I like Debra Glass, but this wasn't my favorite read.",Hot Civil War Read... I wanted more Romance
7,5,This was a book that I thoroughly enjoyed from the beginning to the end. The story line was full of details and kept me involved and entertained. I loved the characters and their quirks. The story was smoothly written . Secret agents and art. Who would have believed how much fun and add a twist of fate and  love.I will read this author again.Enjoy this book you won't be disappointed.,Wow and wonderful read with a twist
8,4,"If the first entry into the series was a toddler's first clumsy attempts at walking, then the second book in the Bewitching Mysteries series shows that the books are quickly maturing into a series worth reading.The plotline of this book has Maggie plunged headfirst into yet another murder mystery in her hometown. When the high school's resident mean girl turns up dead no one is quite sure where to look. The high school sweetheart? The lovestruck friend? Or is it someone completely unexpected? In any case expect a good dollop of witchcraft and slight hints at romance.Overall I really liked the series. There's one or two things that could be changed, most noticably the romantic triangle. It's painfully obvious that Marcus is interested in Maggie (and not dating Liss). It's even more obvious that Tom is not right for Maggie- their romantic scenes just come across as awkward and the reader can't help but wonder when Maggie will realize that she's dating the male equivalent of her mother & sister. For that matter I can't help but wonder if this is all going to pay off in a future book when Maggie FINALLY realizes that she can be her own person without running away or alienating her family. (I.E., her breaking it off with Tom is the defining moment when she realizes that she doesn't have to put up with people telling her how she should live her life or being condescending.) That's pretty much the only big thing that is flawed so far in the series. I know that Alt's probably saving it for some big scene later on in the series, but I can't help but get a little frustrated and impatient. It's just a bit tedious. In any case Alt needs to trim the dead weight (Tom) out of the series & either make him less condescending (making him a more believable romantic possibility) or downgrade him to an occasional character.4.8/5",Steadily getting better!
9,1,"I bought this set and returned it.  I couldn't force myself to finish the first book, A Touch of Silk.  ( They are bundled out of order, too).  The writing and phrasing was so immature that I thought at first it was a satire!  But the pages and pages of supposedly erotic fantasy stuffing the book to bring up the word count was the final blow.  No character development, not enough background.  What should have been interesting read like a pre- teen fantasy.  Don't waste your money.",Childish writing
10,4,"I read mixed reviews on Kiss and Kin But I love Kinsey Holley so I decided I need to make my own opinion and I'm very happy I did :)In this novella Bk. 1 of Werewolves in Love Series she introduces us to Taran and Lark (gotta love the names) who by chance happen to be cousins through marriage not blood. Both these tortured individuals happen to be in love with each other but don't know what to do about for several reasons. I love the Taboo story line :)Lark gets herself into a bad position,GHB and an attempt on her life. When Taran comes to the rescue things progress and wow do they!When you read this story you feel intensity of their feelings towards each other and the struggle they both go through.I love how Kinsey portrays Lark, she is a strong character but falls apart when unsure of herself and Taran. This made her more real to me. And Taran WOW! a patient caring Alpha in cowboy boots :) Yummy.Can't wait to find out what happens next in Yours, Mine, and Howls.Check it out!! Kinsey W. Holley writes - hot, sexy, and shifter if you like that, you'll love this. xoxo",Kiss... Kiss... Kiss :)
11,1,"The only thing that got me to the end of this story was sheer cussedness.  The storyline was flat, there was absolutely no character development, and the dialog was from a cheesy porn.  I found myself increasingly disgusted with the female lead and her whining.  In no way did I find myself sympathetic to the protagonist nor did I find myself even caring what made him who he was.  There was no back story to explain what brought the main characters to this point of the book.  And while I can suspend my belief with the best of them, I just wasn't buying it this time.",I'm being kind with 1 star
12,5,Love the paper. Great writers but cancelled my subscription due to the price. If the price comes down to like $12/mo I might buy it them. I do buy an occasional single issue for $.99 which I really like. Gave 5 stars for the papers content. I can't rate low due to the cost since I was aware of the cost when subscribing.,Great Paper but would like a lower price
13,5,Book moved rapidly. Ending was predictiblebut I really liked. The writer held your interest all the way through. Would recommend it,II Liked It
14,2,"This is not a good ghost story, nor is it a romance. To me it was a poorly written Harlequin romance with a lot of smut thrown in.  The author doesn't appear to know what genre` she's trying to capture.There were numerous typos which I found annoying. The author also incorporated Elvis' name, but did it in a way that I found disrespectful as well as inaccurate. Stephen King she's NOT!If you're looking for a good ghost story, this isn't it. If you're looking for a romance novel, this isn't that either.It had the potential to be an interesting story, but instead turned out to be a mish-mash of ideas.I won't be looking for any other books from this author.",Lousy Read
15,3,"Ok for a quick read, but only the main people stood out, so why add other characters? Oh well it was ok but still rushed in my opinion.not quite sure what went wrong.but I'm sure something did.",unimaginative
16,5,"strong, loyal, brave...that describes Morgan Tallchief...it also describes Kathleen, the girl he believed was killed in an explosion 16 years ago - what a shock when she shows up at his house with her 15 year old daughter who looks just like him, but has her eyes - believable characters, well developed story ...no more secrets between these two",all heroes should be like this man
17,3,i really thought this book was going to be better from the reviews.  Maybe it was more of a teenage type book than an adult one.  I didnt' read the second book in the series was not that interested.,An okay read
18,3,"This was one of Ms Lennox earlier writings and you could really tell, especially if you read a lot of her books.I wanted to like the story, very sweet but hard to accept the characters and main plot of story.",The Greeks baby bargain.
19,4,"When I first came across Jonny Tangerine's Toe Popper I hesitated reading it because of the cover. I just kept visualizing this lady on the cover getting blown up. I think if the cover had just shown the water and sand etc. with no people on the cover I may have felt different and bought it. JMO. My family and friends and I had a discussion on covers and if any of us had not bought a book because of the cover and some of us said "" A picture is worth a thousand words"" and it is the first thing we see when seeing a book is it's cover and it gives an impression of what the book is about. I've come across 3 Kindle story covers that I hadn't bought until I asked my family and friends if any of them have read the story's.I read this story week's ago and am just getting time to write the review. This mystery was gifted to me by a friend who thought I would like it and I am glad that he did because I thoroughly got hooked with the many twists and turns and holding my breath at certain times in this mystery.Characters FBI agent Catherine (I was thrilled to see a strong female FBI lead character) and to know the background and turmoil that Major Joel Lane was going through. These two characters were striving to find out who the culprit was and to put a stop to this madness.I am looking forward to reading more from Jonny Tangerine and I hope there will be a book #2 to this novel.I recommendToe Popperto mystery/thriller readers.",4 1/2 STARS for Toe Popper !! This mystery/thriller had me gasping at times !!
20,5,This book addresses a problem most churches ignore.  Many people leave organized religion because of the pain inflicted by the religious.  Chris Jackson addresses the problem from both sides and offers understanding and healing for the wounded.  Highly recommend this book for anyone who has been offended in church.,Such a neglected subject!
21,2,"I read books not only because I love to read about new characters and their adventures, but also because I want to write. I am currently hard at work on the fourth rewrite of my manuscript, and some of the best places I look to for inspiration are other books. Seeing how the author flows the action, how they make the characters come alive, how they draw me in, gives me fresh ideas on how to make my own writing better. So when I read and review novels, I am not just reviewing as a reader, but also as a writer. I just wanted to add that little disclaimer before I get into my next review.Sammi Ever After, the debut novel from Soma Helmi has a great plot. Sammi, a young girl in her twenties, finds a friend from childhood and instantly falls in love, preparing to move across the world just to be with him. It's her fairy tale come true. Until she arrives at the airport only to find out she has been dumped- over an email. Fairy tale broken. When Sammi finally forces herself off her friend's couch and secures a job and new friends, she decides to take a little journey to try to search for that fairy tale ending. From London to Bali to Greece, Sammi gets tangled in sticky situations and personal revelations, and realizes that her Prince Charming may have been by her side the entire time.Like I said, I think the plot is fantastic. A great story about self-discovery and love, and I am a huge travel geek, so reading about all these destinations I hope to visit had me amped to read this story. But once I started, the writing fell flat to me. Helmi relied on flashbacks and back story when introducing characters, much that was simply not needed and unnecessary to the story. For each flashback, I felt myself became less engaged in the action. Another problem I had was the dialogue didn't seem very realistic. I don't know anyone who would actually describe someone's look aloud by saying ""His sandy blonde hair and piercing blue eyes and the way his muscles ripple..."" That could be the thoughts of someone, but for a person (especially a young girl) to describe someone else that way? It just wasn't believable for me. So as much as I would have liked this plot and the characters that came along for the ride, I do not feel the writing did the story justice.",Sammi Ever After
22,5,Emma Darcy has always been a good writer I love reading her books. they are the best pick me up when I am in a funk so as always great read.,Great Read
23,2,And my but is very personal: I just don't want to get to know the main character who lays beside his wife in bed imagining how he could kill her with the knife he holds.  Don't need it.,"Skillful writing, packs a punch. But..."
24,4,"Way too short.It is a good fun story. It pulls you in and keeps you reading. It's not that it was really too short, just that it was so fun, I tore through it too fast. It's well written with very few errors. What few there were did not stop the flow.",Good...but ;)
25,5,"James Somers has written another great book for all ages, proving that a book doesn't need graphic sex or vulgarity to be good!  It is a fast read, one that would be perfect for younger readers/teens with the right amount of fantasy and imagination without getting dragged out.  A young boy, who is used to being the one picked on, is knocked unconscious by bullies, in his dreams he finds he has ""powers"" beyond the normal and is thrown into a new world where he is important to those around him.  These dream friends accept him, respect him and encourage him.  A great story for anyone who has ever felt ""awkward"" in their own skin.",Another great book!
26,5,"Brody Nash has the perfect idea for the one year anniversary of his relationship with his girlfriend Sidney - a m&eacute;nage with his best friend Drew.  Brody loves Sidney and sharing her with anyone would never have even come up if he hadn't noticed that some of her preferred reads involve m&eacute;nage relationships.Drew Buchanan isn't the settling down kind of guy and he never stays with any one woman for very long.  He leads more of a nomadic lifestyle and often sails off on his yacht aptly named `Sunset.'  He's a brilliant desert chef and creates his delectable treats for Brody's restaurant, The Blue Fish Grill, whenever he's in Graceville but he's finding it harder and harder to stay in town especially since he's in love with Sidney.Sidney McCall has always lived a nomadic lifestyle.  Her mother never stayed in one place very long and she simply continued the lifestyle she already knew - until she met Brody.  They quickly moved from the initial meeting to living together and even a year after the fact, Sidney still feels like it's all a dream.In celebration of their first anniversary together Sidney plans to surprise Brody with a delicious meal along with a sexy outfit when he returns home from the restaurant - and succeeds.  Brady had intended to tell Sidney that he'd invited Drew over and about his surprise but one look at her in her sexy dress and all his brain cells headed south.  Dinner's put on hold while they satisfy other hungers - until they hear the knock at the door and then Brody remembers that he still has to tell her about his `gift.'  Sidney can't deny an attraction to Drew and even though she isn't entirely comfortable with the idea of sex with two men at the same time it is a fantasy of hers and if it's alright with the men then who is she to argue.  Things turn decidedly odd afterwards and Sidney's not sure what to think about Drew's cold disinterested attitude and to make things even more complicated Brody notices her preoccupation and assumes that it's more than just friendly concern.Sami Lee delves into what could happen when the thing you fantasize about turns out to be the exact opposite of what you truly desire.  Sidney and Brody are deeply in love with each other but neither of them are truly certain of the others feelings.  I found the dynamics between these three characters to be oddly fascinating but at the same time understand why Drew's held himself apart from Brady and Sidney.  I'd love to know what happened with Drew after this story ends.  He's a special guy who deserves a little happiness in his life and a special woman.Chrissy Dionne (courtesy of Romance Junkies)",4.5 blue ribbons from Romance Junkies
27,3,"Aside from the clich&eacute;d marathon sex in this book I was left pretty confused by the ending as to what exactly I had just read. Did she dream it? Does he recognized her? I'm not really complaining because it's free and I did enjoy reading it for the most part, but there was nothing very special about it and the ""twist"" if that's what you call it at the end really just left me scratching my head. A bit of fluff with not a lot of substance, this book is fine if you are just browsing for something free to read because there's really nothing more than that to it.",Hot and Confused?
28,5,"This is my first Lori Foster book(s) - great story about 4 brothers - haven't finished reading about Jordan yet but decided to give a review.  Romantic, good story and great characters with lots of humour.  Think my Kindle will be checking out some more of Lori's books.",Love these guys ...
29,5,"I have read tons of books, and this is one of the best books I've ever read! Imagine the concept of a hitch-hiking serial killer being picked up by a serial killer! It's hilarious! I've read all the versions and prequels and sequels that Kilborn and Crouch wrote about these characters, and let me tell you they are all great! They have some really twisted minds, and I love that. Kinda reminds me of myself lol. Keep it up you two, because I want to read more of your stuff! And don't ever hitchhike!!!",The greatest story ever!
