index,rating,reviewText,summary
155,2,"This book deserves 2.5 stars. It's not the worst thing I've read, yet it wasn't the best either.The protagonist, Emily Fenwick, is a police officer who is suddenly whisked into an alternate New York set in 1890. Except it's not really an alternate New York, nor are there any scenarios that could be labeled steampunk. It's more fantasy-based with a world that I found intriguing.Emily wakes up in Steamside, a world connected to 1890's ""normal"" New York. Steamside's inhabitants are refugees like Emily who long to return to their times. Why are they here? It's not clearly explained, and that's not a good thing, which is a shame because Steamside is interesting.Rather, the setting is used more as a backdrop to a juvenile, nonsensical romance between the two leads. POVs were difficult to distinguish, and the dialogue was all jumbled up. The romance was tedious and unbelievable. Have I mentioned juvenile?It was a fun read, but Steamside Chronicles just wasn't the best.",Light fun
156,4,Was just getting into the story when bammm it ended. Did not expect this to be a short story but enjoyed it all the way.,Way too short
157,1,Well I must say this book was only alright - I would not say it captivated me it was far from it actually - thank god it was free - I did not think much of it but then others would probably love it,hmmm well
158,5,"Good read short but cute, I enjoyed the read. Great job to the author, can't wait to read her next book",The Billionaires Baby
159,5,"This was a wonderful--wonderful book.  It had love, intrigue, mystery, everything that a book should have.  There were only a few typos!",Seventy and. Counting
160,2,"Day of Sacrifice: The Prophecy (Day of Sacrifice Stories #1) by S. W. Benefiel(Discloser: I received this eBook free in order to write a review)Summary:Flora is approaching her twenty first birthday.  That is normally an exciting time for a young woman, but Flora isn't normal.  She is the first born in her family and, therefore, is the family sacrifice to the Gods.  Her entire life has lead up to the day of her death.  Her sacrifice ensures the Gods blessings on her family.  Flora is a bit of a rebelled but she knows her duty.  She pushes the limits to the fullest extent but she knows what will happen on her birthday.  Her pure body (she's a virgin) will be sacrificed to the Gods.My thoughts: (Some spoilers)For a short story, this novella was packed with a lot of story.  An entire background was given for a society that contains supernatural beings (witches, werewolves, and vampires) as well as lowly humans.  Included with the background for the story, a short tale was included.  While I think that the background information was well done, I'm not sure that the characters were as well developed.  The story happened very fast and I was unclear why chances were taken.  Some of it seemed very convenient to the story.  The idea of sacrifices was clearly disliked by many characters in the story but it seems that it has gone on for quite a few years.  Such ingrained tradition doesn't get challenged on a whim.  There just wasn't enough story invested to make any kind of changes.  Clearly, I am implying that there is a challenge to the idea but I won't say any more about it.Personally, the book was too graphic with too many uses of the F word but if those things don't bother you, then you may like this book.  With all that said, I give this novella a 2 out of 5.",Too Short to really work well
161,3,"This was a quick read.  I didn't feel much of a connection between the characters, you feel like you are just jumping right into the middle of the story.  There is hardly any history between the characters, so it was difficult to develop an opinion of their relationship. This is a good weekend read that's just for fun.",Fast read.
162,5,"An excellent read, extremely descriptive. You almost feel as though you are one of the characters. This is the first Novel that I have read by Jules Verne and will not hesitate to read further stories by him,no matter how far fetched they may have seemed when he first penned them.If you enjoy a bit of fantasizing I would have no problems in recommending that you purchase ,sit back and enjoy.",Mysterious Island
163,4,"What a delightful novel! The characters were well-rounded and extremely likeable. I also appreciated the effort that was put into Povre's native language. In addition, the plot was intriguing and I didn't want to stop reading. I'm looking forward to more from this author!",Captivating
164,3,"I like the book and will read the others but the word usage and constant typos are distracting. At least someone should proof the manuscript before it gets this far. In the way distant past these people were called editors.Seriously, the errors come so often that it is actually difficult to follow the story sometimes. You find yourself looking for the next misuse of a word like ""there"" instead of the proper ""they're."" I mean this is pretty bonehead stuff and either show someone really just typing instead of writing or someone who is displaying a real lack of education. This happens pretty much every page.",Needs an editor - bigtime
165,3,"This is a short story first published in 1940 as a two part serial in the pulp fiction magazine Argosy. The author later decided to develop the characters in three novellas which have also been adapted to the Kindle. This is a very quick read, and thus since it is so inexpensive I recommend that anyone who is interested in the genre and plans to read the subsequently published books( which I rate highly) should read it first.The main character in this book is the detective Doan, and unfortunately his huge Great Dane Carstairs makes only a cameo introductory appearance.  Fortunately, in the subsequent stories Carstairs plays an integral role and adds immeasurably to the reader's enjoyment. Doan's unimpressive appearance leads his adversaries to underestimate his (and Carstairs') skill and intelligence, and in this introduction to his character the author has not yet fully developed Doan's skills. However, it is still a typical pulp fiction story concerning a hard boiled detective except for the fact that as the author developed the characters over the series he injected much more humor than was usual for that era.After an interesting introduction to the series' characters in the first few chapters, Doan is tasked to protect a young heiress about to receive her inheritance. He travels to a wilderness resort cabin, and becomes isolated there with a strange cast of characters while a blizzard rages outside. However,  murders occur, misdirection abounds, and of course he eventually untangles the web of deceit, earning his keep and rescuing a damsel in distress.. As in all short stories of this type, the prose is spare and the character development minimal. But a fast pace keeps the reader's interest.Unfortunately,  the author Norbert Davis is not as well known as other pulp fiction writers of the period for three reasons. First, his stories encompassed a wide array of genres, so he never built a reputation as a practitioner  of specific type (e.g. detective, SF, etc.) . Second, his detective stories included a strain of humor which was highly unusual for the period, a hard boiled detective story was not supposed to be funny. Third, he committed suicide at age 40, supposedly after he had been diagnosed with cancer. Thus, his potential literary legacy was truncated. However, among his peers he was regarded as in a class with the best writers of the era, including Hammett and McDonald. He graduated from Stanford with a law degree, but never took the bar exam - choosing instead to pursue a career which he had already established by being published while still in college, usually being paid at the going rate of a penny a word. Hopefully, the advent of ebooks and specialized small presses will allow many more potential fans to enjoy his works and be delighted by Carstairs' collaborations with Doan.Also, after reading this short story you can decide if you agree with me that the author's choice of title was very clever due to the multiple images invoked.Tucker Andersen 6/4/2010",Recommended as Intro to the Series - Wonderful Character Sketches
166,1,"This is not objective research presented in a scholarly manner. The author is very narrow-minded, providing readers with nothing useful in gaining insight into the criminal mind. This is a speculative rant, nothing more. Do beliefs and emotional gratification play a part as to why people commit criminal acts? Of course they do. But this short read provides no hard evidence in support of that as I was expecting before reading this. This serves as a good example of the kind of crap that should be avoided by anyone hoping to actually contribute to the issues of crime and prevention.",A Speculative Rant - Not Objective Research
167,3,I found this book rather slow and in fact haven't finished it yet.  Don't think I will try this author again.,In The Backwoods of Nowhere
168,5,"Read all 16 books in a month, can't wait till the next book in June to come out already pre ordered it also looking forward to more books on the McKay and West family. Like to see if anything happens to Seirre and Boone. Please keep up the the greats stores",Great story's
169,4,"I loved this book. Victor has one of the most fascinating voices I've met.He is not bothered by his flaws and moderately interested in what happens around him if he's not involved. Things and people almost happen to him. He is absorbed in himself and at the same time he doesn't take himself too seriously. His psychic powers are an annoyance and he would clearly get rid of them if he could. Although he's been trained to use them, it's clear he didn't pay much attention during his classes and people around him always seem to know more than him. He tries to turn down his psychic abilities popping drugs like candies, but he's never hiding himself and he doesn't seek for excuses. He is what he is.At the beginning I thought the unconscious way he attracts Jacob Marks, who is his exact opposite, elegant, smart, sexy, was impossible to understand and I felt the author owed us some sort of explanation. Now I know it's not necessary. Jacob falls for Victor like I fell for him as a reader: fast, hard, with no apparent reason.This is the first book of a great series. I give it only four stars out of frustration because it's too short!",You'll love Vic!
170,3,"This was definitely a hot read. The heroine was likeable and nice, but the H was an overbearing jerk who veered really close to the line for me. The tension was really well crafted though.",A bit overbearing
171,4,"My Dad, God bless him, was an avid fan of Lovecraft and I refused to read it when I was younger because of a  nightmare I had after one of his short stories.  Now I enjoy reading them.  Some are a little too repetitive in that he reuses certain material.  At least one had virtually no ending.  Some are too predictable.  All are well written and pleasant to read, just a little dated.  I would have to say overall that I enjoy the stories in the book and would recommend it if you are tired of some of the more modern trends in writing.  With Lovecraft you have to have an imagination.  He counts on it and plays with it in order to achieve his goal of giving you the creeps.  He takes you just so far and then lets your mind do the rest.  This requires a certain talent both from the writer and the reader.  A nice collection of stories to keep your mind occupied when you need it.",You really cannot go wrong here.
172,3,"i think i got this book free.it was well worth the cost.don't spend more than .99 on it.it's a light read, i didn't love the male character his (non-sexual) personality was kind of lame-o.but the sex was good.",light read.
173,4,"This is Jules Verne's attempt at writing a Robinson Crusoe / Swiss Family Robinson castaway story, with the twist that the five castaways crash-land a balloon and thus come to the island with almost nothing -- unlike Crusoe or the Swiss Family, the castaways here don't have a boat-full of resources, tools, etc., to fall back on, and have to make *everything* themselves, from the ground up, armed only with their knowledge of science and engineering. Since it always seemed to me that Crusoe and the Swiss Family cheated a bit by bringing so many tools and so forth along with themselves, I really enjoyed the more scientific focus, and this has now replaced Swiss Family as my answer to the ""what one book would you want with you on a desert island?"" question.Parts of the novel drag a bit, but it's a Jules Verne novel so there's a good story here -- the Island has a mysterious unseen inhabitant, also, there are pirates, which is always awesome.The main flaw is that this is based on the 1875 Kingston translation, which makes a fair number of edits on Verne's original -- for example, it changes some of the protagonists's names and removes some of Captain Nemo's anti-imperialist, anti-british rhetoric. There's a more accurate translation available for free in the Kindle store, so I'd recommend grabbing the accurate version instead (look for the edition where the engineer is named Cyrus Smith, rather than Cyrus Harding;  Kingston reportedly felt ""Smith"" was a ""gypsy name"" and hence unsuitable for a heroic character. You can find that version in the kindle store here:The Mysterious Island)Oh, yeah, Captain Nemo. This book is in some ways a sequel to Verne's _Twenty Thousand Leagues under the Seas_, as well as to his _In Search of the Castaways_. The sequence isn't direct -- really more a case of cameo characters than a direct plot sequel to either book -- but you might want to read those two books first before picking this one up.",Verne's version of Robinson Crusoe
174,1,"It may be unfair to review a book that I haven't finished, but it seems like it would be even more unfair to spend more time reading this horrible book.I spent many years in my 40s dating, mostly men that I met via online dating sites. It wasn't always fun or pretty, that's for sure, but I've got some darn funny stories. That's what I expected this book to be about. I was wrong.Quinn, the heroine, has no sense of humor. None. And she's selfish and mean. Others have commented on her narrow minded view of men, (which is true) but I found the fact that she was mean to her elderly neighbor to be an even bigger turn off.I've already wasted a couple hours reading this book, but it's not too late to save yourself. You've been warned.",Too painful to finish.
175,4,"I look for bundled series for the Kindle and was pleasantly surprised with this one. A historical fiction featuring a heroine that is coming into her own, it manages to have romance without dragging sex into it too much (so far in the series) and a plausible mystery.  It manages to keep the heroine within character for her timeline rather than making her a modern-day woman in a corset and bustle.",why not put the others in this series in a bundle as well
176,3,"I don't generally read short stories, as I find they leave me wanting more, and this book was no exception. I think the characters could have been developed a little better, I didn't really get a good sense of how the characters were feeling. I think with a little work this book could actually be something, but as is, it just reiterated to me that I need to stick with what I like, and short stories are not it.",Good Concept
177,3,"Ok I admit I need to pause a minute to write this review.  This is such a different plot line than other reads. This is most like Terminal Freeze by Lincoln Child.  The whole idea of a relic creature.  Just enough science to hold my interest, but both the characters and the story line could have been expanded on they where both a little light and not enough details.  I would enjoy reading additional stories by Dallas Tanner.",Interesting story line
178,2,Fire creates evidence it doesn't destroy it. Proof that the cops can make a thousand mistakes a crook can only make one.,Not too Perfect
179,2,"OK I was prepared for ""chick lit"" and ready for it to be just another dumb romance, but the treatment of characters and the things they did etc was especially shallow. What I cannot forgive, however, is the misuse of words in a book!!!  Writers need to do more than use spellcheck to find those--they need to actually READ THE BOOK.  They started showing up @ 75%, so for some reason the writer got in a hurry to finish this book. Perhaps they were sick of it too.unforgivable are:peace when it should be pieceshuttered when it should be shudderedsaver when it should be savorknow when it should be nowsummons when it should be summon...And I did not set out to look for errors, these just jumped off the page they were so bad...it disrupts the entire thought process when you run across stupid errors like these.I'm glad I did not pay for this book, as it wasn't worth any money. I will not read anything from this ""author"" again.In this day and age everyone seems to think they can write a book, but it is not that easy to write a GOOD book. I suggest this writer read some very good books to figure out why this stuff is just ""tripe"".  The author needs to take English 101.  The mistakes above are just unforgivable for anyone who purports to be a writer. A high school student could write something like this--and perhaps they did.",oh please
180,5,"Rafe and Emma forever, I luved this book so much and wish i could read more of those two. Sad that book was too short, but i guess oh well!!! Was happy that it was the best ever after for the both of them!!!","LUV IT, LUV IT!!!"
181,3,"This book would be good for a person who has no working knowledge of mind maps.  It was rather basic.  As a person with some background knowledge, I didn't find it to be personally helpful.  If you are new to mind maps, though, give this book a try.",just the basics
182,1,"This is quite possibly the worst book I've ever read. And definately the worst ""short stories"" I've ever read.  Poorly written and poorly executed, how this book got published is a mystery to me.  And even tho it only cost me 99 cents on my kindle, I would like to have that money back Mr. McAfee.","Awful, just awful"
183,2,Can't write much about this book as I just couldn't get into it.  Tried to go back several times but nothing about it caught my interest.,Just couldn't get into it!
184,4,"I downloaded to read while on vacation!  It's a good paper, covered just about everything I was interested in reading about!",A Good Paper
185,4,"Fun book, witty characters and out of this world scenery well thought out, some laugh out loud bits and a quick pace - very enjoyable !",fun read !
186,4,"I enjoyed this series more than I would have expected given that I don't typically like historicals. I really liked how the author captured the repressed nature of the time period, and the angst felt by the main characters made this a very enjoyable series to read. Also, always enjoy reading books that don't have grammatical or spelling errors :)",A good series
187,2,I thought this was gonna be a hot and sexy story but it turned out quite average the sex scenes wasnt as sexy as I liked it and the miscommunication was tiresome,average
188,1,"This is a ""story"" for those who wish to read repeated (and boring) descriptions of genitalia.  The author is very focused on the heroine's  breasts (we are repeatedly told about size and colour) and on the hero's nether regions. There was almost a story in between the anatomy fixations-- almost, but, not quite.  Instead of developing a good story the author went into soft porn.  If she wishes to write Bodice-Rippers, I do wish she would just label them so.  I had read two of her ""Bubba"" stories and enjoyed them enough to overlook the little forays into crudeness.  This book was just to low to want to read more of her work.  If she would just focus on the mystery and witty repartee, it would have been a good read.  I still have hopes for the next ""Bubba"" in the series, that she will concentrate on a good story that even your Momma could read.",crude
189,1,"Must read.  Few grammatical errors but a wonderfully, funny, loving story. The character Miranda steals the story with her fearless dedication and love. The book was written  at the turn of the century but evil is never new.",Phones Sea Marcia Schuyler
190,4,"I love historical fantasy, but seeing as how this was a short story, I really couldn't get into it all that well. What I did read was wonderful!",Pretty Good.
191,4,"My Review:Heath- architectColt- police detectiveKylie- school teacherRoommates Colt, Heath, and Kylie have lived together for 7 years and at every birthday, they celebrate with a game of Tequila Truth. At the last game, 6 months ago, the game took a risque turn which titillated Kylie's imaginations. Ever since, she has been taking dangerous risks in the form of sexual experimentation. Risks that have finally spilt over to Colt and Heath when Colt comes home early from work one evening and finds Kylie's date getting too rough in the bedroom and hurting her.  Colt and Heath decide that Kylie needs room to experiment with men that she can trust so they offer her their sexual services for a weekend of no-holds-barred sex for all three of them. Things take a decidedly hot turn from there.Wow! These 3 have been roommates for 7 years and have never crossed that line, but when they do, they go big! Colt and Heath both have Dom tendencies. They definitely take charge in the bedroom which is what Kylie is searching for in her fantasies. Above everything else, these 3 have been best friends forever and that definitely plays out in the bedroom. There is complete trust and love between all three of the and it's really incredible to read. There is a natural flow between the three of them. But when the weekend starts to come to the end...that's when things really get good. *sigh* You all know that I am a sucker for romances that start as friendships. A fabulously written menage romance! LOVED IT!",I really liked this one...
192,1,This book could only be a joke.  Which man is going to allow other men to grope and fondle the woman he is about to marry.  The way this goes she should have screamed or called the police from the beginning of the book.  She was in a room of perverts and she even became one.  This book was sick.,Board resolution
193,5,I really enjoyed this Scottish historical romance. I think it's one of the first I've read that was set in the mid nineteenth century where the characters weren't leaving the country. I look forward to reading more from this author and would definitely recommend it to others.,really good book
194,3,"This book is a fast read, beach type book. The plot revolves around mistaken identities and misperceptions and is completely character driven. The characters are interesting, if not too complicated, and the writing is good.When Diona Brown's younger sister, Daryle, takes off for Greece to marry a man she met on vacation, Diona goes after her to stop the wedding. Nikias, the older brother of Daryle's boyfriend, Alexis, is dead set against his little brother marrying a ""gold digger"", and also plans to put a stop to the wedding. While the young lovers hide under an alias, Diona checks into a hotel under her own name, and Nikias arranges for her to be ""invited"" to stay at his island home. Diona thinks the invitation is from her sister's boyfriend and accepts the invitation so she can talk them out of the marriage. When she arrives on the island, she's met by older brother Nikias who is convinced that Diona is the woman his brother plans to marry, and he informs her that he plans to keep her prisoner on the island until her flight home. Nikias is sure he has the right woman and no amount of arguing or reasoning on Diona's  part will convince him otherwise.Nikias is disturbed by how much he is drawn to his  brother's supposed girlfriend. He's rich, handsome and a bit of a playboy, but he's never been attracted to a woman like he is to her.  As he and Diona spend time together, he starts to wonder if maybe she's telling the truth, but he won't let himself doubt that he's right. As the mistaken identities get worked out, the broken trust remains an issue, both for Diona and Nikias and Nikias and his brother, Alexis. Until that can be mended and the breaches healed, those relationships have no chance. Working out their trust issues and getting past the perceived deceptions will take a lot of faith and love, something that they don't have much experience with.Heat factor hot.",Interfering siblings
195,4,"The author of this blog puts in a lot of effort vs. a few lines here and there.  I especially like the tips, answering of questions, and thoughts on the eBook market.  I read in one of his posts he tries to write 1,000 words a night - he does, and it is usually full of quality.  he s well-known on the discussion board sof being helpful, and I see that flowing through on his blog.  I would give it a 5-star, but took one away as sometimes there are ""rants"" in the postings that continue over time; however, I do recognize that is the nature of blogs!  :}Bottom line here is the 99 cents for this blog is money well-spent, probably in the top three of the approximate ten I subscribe to for Kindle content!  Keep up the good work!",Lots of Effort in this Blog
